hate,text,cleaned_text
2,if someone slaps you on your right cheek hand him your left lekin agar dobara maare to pel daalo betichod ko  mahatma gandhi xf0x9fx98xaa,someone slaps right cheek hand left lekin agar dobara maare pel daalo betichod ko mahatma gandhi xfxfxxaa
2,rt   happy birthday betichod xf0x9fx98x82xf0x9fx98x82xf0x9fx98x82xf0x9fx98x82,rt happy birthday betichod xfxfxxxfxfxxxfxfxxxfxfxx
2,madarchod canadian  ke lawde fan highcourt has acquitted salman khan jaakexe2x80xa6,madarchod canadian ke lawde fan highcourt acquitted salman khan jaakexexxa
2,xf0x9fx98x82xf0x9fx98x82xf0x9fx98x82xf0x9fx98x82 betichod xf0x9fx98x82xf0x9fx98x82xf0x9fx98x82,xfxfxxxfxfxxxfxfxxxfxfxx betichod xfxfxxxfxfxxxfxfxx
2,rt  aur bana li toh ye betichod gujarat it cell chief,rt aur bana li toh ye betichod gujarat cell chief
2,wo betichod bhi underground ho gayan ye yaad kar raha tha tujhenmeeta de iski tharak,wo betichod bhi underground ho gayan ye yaad kar raha tha tujhenmeeta de iski tharak
2,aur thori si english padhni aati ho na bhosdiketo pic ka uxe2x80xa6,aur thori si english padhni aati ho na bhosdiketo pic ka uxexxa
2,happy birthday betichod xf0x9fx98x82xf0x9fx98x82xf0x9fx98x82xf0x9fx98x82,happy birthday betichod xfxfxxxfxfxxxfxfxxxfxfxx
2,chutye chaiwala neech aadmi betichod,chutye chaiwala neech aadmi betichod
0,they are not in love nbut after 1200 at night they dont let anyone disturb them nwhy xe2x80xa6,love nbut night dont let anyone disturb nwhy xexxa
2,g mara betichod,g mara betichod
2,naam change karke rakhkr all liberal betichod,naam change karke rakhkr liberal betichod
2,betichod  tere jaise logon ki patak patak ke gaand li hai maine wahan tu baccha hai abhi,betichod tere jaise logon ki patak patak ke gaand li hai maine wahan tu baccha hai abhi
2,wah betichod kya kanni kaata hai,wah betichod kya kanni kaata hai
2,rt   nahi dikh raha hai lund toh nhi kaat diya betichod ka karni sena waalo ne,rt nahi dikh raha hai lund toh nhi kaat diya betichod ka karni sena waalo ne
0,reposting panditnxf0x9fx98x82xf0x9fx98x82 pandit nbackchod bakk backchodi memelife memes lollil lel simpsonsxe2x80xa6,reposting panditnxfxfxxxfxfxx pandit nbackchod bakk backchodi memelife memes lollil lel simpsonsxexxa
2,lund hila ke good morning betichod,lund hila ke good morning betichod
0,dc fans after watching the trailer of marvels  infinity war xf0x9fx98x82 dc marvel dcvsmarvel betichod,dc fans watching trailer marvels infinity war xfxfxx dc marvel dcvsmarvel betichod
2,bhaag saale candian hamara pm usspe pehla haq hamara haitum sala betichod canadian kuttexe2x80xa6,bhaag saale candian hamara pm usspe pehla haq hamara haitum sala betichod canadian kuttexexxa
2,tu h hi meri asli rakhailnbetichod ki aulaad h tuu saalinbaap ka lund leti h abh meri raand,tu h hi meri asli rakhailnbetichod ki aulaad h tuu saalinbaap ka lund leti h abh meri raand
2,ara o bundi ru aale chutiye tu tne mere saale issa pitunga ghr k ne b pehchaan main naavexe2x80xa6,ara bundi ru aale chutiye tu tne mere saale issa pitunga ghr k ne b pehchaan main naavexexxa
2,betichod thats a first xf0x9fx98x85,betichod thats first xfxfxx
2,mubarak ho betichod ek mahina hogya 8 baqi hai xf0x9fx98x82xf0x9fx98x82,mubarak ho betichod ek mahina hogya baqi hai xfxfxxxfxfxx
2,ye le betichod ye tha,ye le betichod ye tha
2,kauwe mera ek follower kam kara diya betichod tune  kisssssssssyyyy,kauwe mera ek follower kam kara diya betichod tune kisssssssssyyyy
2,bolenge bhaichod kyu nai likha xf0x9fx98x82,bolenge bhaichod kyu nai likha xfxfxx
2,saali bhaichod,saali bhaichod
0,its been fixed with a patch everyone should update,fixed patch everyone update
0,this tweet made my night ecstatic to read about your euphoria xf0x9fx92x95,tweet made night ecstatic read euphoria xfxfxx
2,bhaichod,bhaichod
2,ni ni phr maza kesay ayega yeah kia bhenchod bhaichod chutiapa ha xf0x9fx98x9fxf0x9fx98xb1,ni ni phr maza kesay ayega yeah kia bhenchod bhaichod chutiapa ha xfxfxxfxfxfxxb
0,yay,yay
0,rt  new 6la8 track,rt new la track
0,my apologies did not get the msg correctly,apologies get msg correctly
2,motherfuckers     fatherfuckersnbhainchod     bhaichod,motherfuckers fatherfuckersnbhainchod bhaichod
0,lol aww theyre truly blessings,lol aww theyre truly blessings
0,new 6la8 track,new la track
2,inki maa ke choot maadherchod haramzaadio iss desh ke khaati is desh ko he gaali deti hai,inki maa ke choot maadherchod haramzaadio iss desh ke khaati desh ko gaali deti hai
2,sejal tu raand h ya rakhail sali ye bta pehle,sejal tu raand h ya rakhail sali ye bta pehle
0,xd9x8axd9x84xd8xa7 xd8xb9xd8xb4xd8xa7xd9x86xd9x83 xd8xa8xd8xb3,xdxaxdxxdxa xdxbxdxbxdxaxdxxdx xdxaxdxb
0,rt  this yearxe2x80x99s goldenglobes best tv actor nominees     xe2x80xa6,rt yearxexxs goldenglobes best tv actor nominees xexxa
0,xd8xa7xd9x84xd9x84xd9x87 xd9x8axd8xb9xd9x8axd9x86xd9x83,xdxaxdxxdxxdx xdxaxdxbxdxaxdxxdx
2,aaja mere lund me unchalna k liya xf0x9fx98x82xf0x9fx98x82 aag bhasam ho jayegi xf0x9fx94xa5,aaja mere lund unchalna k liya xfxfxxxfxfxx aag bhasam ho jayegi xfxfxxa
2,i will fuck you like this bouncy bouncy,fuck like bouncy bouncy
2,attention ki hawas hi hai yan lun ki bhi itni hi hawas hai tere jaisi raand apne sakhe bhai say bhi sex kar lei,attention ki hawas hi hai yan lun ki bhi itni hi hawas hai tere jaisi raand apne sakhe bhai say bhi sex kar lei
2,hansabse purani raand he madhu twitter ki,hansabse purani raand madhu twitter ki
0,xd8xa3xd9x88xd9x81xd9x81xd9x81xd8xb1 xd9x88xd8xa7xd9x84xd9x84xd9x87  xf0x9fx98x82xf0x9fx98x82xf0x9fx98x82xf0x9fx98x82xf0x9fx98x82xf0x9fx98x82xf0x9fx98x82xf0x9fx98x82,xdxaxdxxdxxdxxdxxdxb xdxxdxaxdxxdxxdx xfxfxxxfxfxxxfxfxxxfxfxxxfxfxxxfxfxxxfxfxxxfxfxx
2,rt   aaja mere lund me unchalna k liya xf0x9fx98x82xf0x9fx98x82 aag bhasam ho jayegi xf0x9fx94xa5,rt aaja mere lund unchalna k liya xfxfxxxfxfxx aag bhasam ho jayegi xfxfxxa
0,xd9x88xd8xa7xd9x84xd9x84xd9x87 xd8xb9xd9x84xd9x89 xd8xa8xd8xa7xd9x84xd9x8a xd9x8axd8xb7xd9x84xd8xb9 xd8xa7xd9x84xd8xb5xd8xa8xd8xad,xdxxdxaxdxxdxxdx xdxbxdxxdx xdxaxdxaxdxxdxa xdxaxdxbxdxxdxb xdxaxdxxdxbxdxaxdxad
2,sun aye raand ki aulaadnram rahim aur asaram ka lund kam pade toteri maa axe2x80xa6,sun aye raand ki aulaadnram rahim aur asaram ka lund kam pade toteri maa axexxa
2,his ass was so tasty,ass tasty
2,tu kaun si raand se kam hai ravina,tu kaun si raand se kam hai ravina
0,hat sab idiot nahin hain people know sab kuch,hat sab idiot nahin hain people know sab kuch
2,tum raand ho,tum raand ho
2,aise koi to chode meri  ko,aise koi chode meri ko
2,raand ko bc bs lund chshiyetujhe ni chahiyeraasnd ku aulad,raand ko bc bs lund chshiyetujhe ni chahiyeraasnd ku aulad
2,saali raand chus ye garam land,saali raand chus ye garam land
2,rt   asli  raand hai mere office table pe aise aa ke baithi thi,rt asli raand hai mere office table pe aise aa ke baithi thi
2,mere pass aa randi teri janmo janmo ki pyas bhujha dunga,mere pass aa randi teri janmo janmo ki pyas bhujha dunga
2,rt  meri djannoo raandsejal  saath gangbangkarwayegiiiiiii bolnaa merikutiyaaa,rt meri djannoo raandsejal saath gangbangkarwayegiiiiiii bolnaa merikutiyaaa
2,aa ja meri raand lund per seedha,aa ja meri raand lund per seedha
0,xd9x85xd8xaaxd8xadxd9x85xd8xb3 xd9x85xd8xb1xd9x87 xd8xafxd9x83xd8xaaxd9x88xd8xb1xd9x83xd9x85 xf0x9fx92x94,xdxxdxaaxdxadxdxxdxb xdxxdxbxdx xdxafxdxxdxaaxdxxdxbxdxxdx xfxfxx
2,jaa na unpadh raand ki chaati aulaad tere baap ko sikhaya hota sex to tere jaisa chodu paida na karta,jaa na unpadh raand ki chaati aulaad tere baap ko sikhaya hota sex tere jaisa chodu paida na karta
0,rt  donxe2x80x99t worry babyyouxe2x80x99re going to love me even more for thisnnyourdeviantsin,rt donxexxt worry babyyouxexxre going love even thisnnyourdeviantsin
2,ye le raanddal muh me,ye le raanddal muh
2,1 no ki raand hai wo,ki raand hai wo
0,rt  youxe2x80x99ve been a naughty girlyou know how to make it up to mennyourdeviantsin,rt youxexxve naughty girlyou know make mennyourdeviantsin
2,aise rape hoga tera but fir ek baar andar ghus jayega na tere tu khud nahi rok payegi apne apkoxe2x80xa6,aise rape hoga tera fir ek baar andar ghus jayega na tere tu khud nahi rok payegi apne apkoxexxa
0,xd9x88xd8xb4 xd8xa7xd9x84xd8xb7xd8xb1xd8xb1xd8xb1xd8xa8xd8xa8 xd9x87xd8xb0xd8xa7,xdxxdxb xdxaxdxxdxbxdxbxdxbxdxbxdxaxdxa xdxxdxbxdxa
2,raand,raand
2,mumtazbano sonagachi ki raand,mumtazbano sonagachi ki raand
2,fuck off bhadwe kejri ki raand,fuck bhadwe kejri ki raand
2,rt  aise koi to chode meri  ko,rt aise koi chode meri ko
0,xd9x87xd8xa7xd9x84xd9x85xd8xb1xd9x87 xd8xa8xd8xb3,xdxxdxaxdxxdxxdxbxdx xdxaxdxb
0,xd8xa7xd9x81xd8xa7,xdxaxdxxdxa
2,rt   morning raand,rt morning raand
2,uffff zeba raand teri bur ko jhamke chodoonga,uffff zeba raand teri bur ko jhamke chodoonga
0,rt  i had to go even longer than 280  if you donxe2x80x99t like reading the gist is thanks a bunch  for the nomxf0x9fx98x8axf0x9fxa5x82 hxe2x80xa6,rt go even longer donxexxt like reading gist thanks bunch nomxfxfxxaxfxfxax hxexxa
0,is that true,true
0,ek din karna hai aisa,ek din karna hai aisa
2,my slutty slave,slutty slave
2,rt  unique phenomenon as far as longevity in pornn30 years in the first line of adult entertainmentnking of ir f2m rimmingxe2x80xa6,rt unique phenomenon far longevity pornn years first line adult entertainmentnking ir fm rimmingxexxa
0,jo b karna ha dm me aaja sab kar denga xf0x9fx98x82,jo b karna ha dm aaja sab kar denga xfxfxx
0,aag bhasam hi to nhi karni balki badhani hai,aag bhasam hi nhi karni balki badhani hai
2,me hoon naa raand tere liye,hoon naa raand tere liye
0,xd9x85xd9x86 xd8xacxd8xafxd9x83,xdxxdx xdxacxdxafxdx
2,rt   oohh wow kiya snskaar dikhaa rhi ha ye raand uuffffff,rt oohh wow kiya snskaar dikhaa rhi ha ye raand uuffffff
0,rt  when my secretary does something wrongshe knows the drillnnyourdeviantsin,rt secretary something wrongshe knows drillnnyourdeviantsin
2,mera randwa to available hi nhi hota jab bh aag lagi hui hoti badan mai,mera randwa available hi nhi hota jab bh aag lagi hui hoti badan mai
0,ji ha,ji ha
2,rt    hansabse purani raand he madhu twitter ki,rt hansabse purani raand madhu twitter ki
2,mera lund mu me kab legi tu,mera lund mu kab legi tu
1,teri breakfast ready hi lelo mulli raand,teri breakfast ready hi lelo mulli raand
0,rt  goldenglobes nominees best supporting actor tvnndavid harbournalfred molinanchristian slaternalexander skarsgardndavid thewlisnnsexe2x80xa6,rt goldenglobes nominees best supporting actor tvnndavid harbournalfred molinanchristian slaternalexander skarsgardndavid thewlisnnsexexxa
2,zairawasimmolestation galti ho gayi teri movie secretsuperstar jaake dekhintum saali randi tumko kothe pe nachxe2x80xa6,zairawasimmolestation galti ho gayi teri movie secretsuperstar jaake dekhintum saali randi tumko kothe pe nachxexxa
2,teri gaand me lauda fasa kr peluga tujhe meri chinnal,teri gaand lauda fasa kr peluga tujhe meri chinnal
2,raand aaja kha ja mera land,raand aaja kha ja mera land
2,ohhobade bade chudakad raand aa rahi he aaj,ohhobade bade chudakad raand aa rahi aaj
2,ufffff raand chus mera uncut lauda zeba,ufffff raand chus mera uncut lauda zeba
2,kon is slutty raand ko kuttiya banakar chaddega nsherlynrandchopraxf0x9fx98x8dxf0x9fx98x8dxf0x9fx98x8d,kon slutty raand ko kuttiya banakar chaddega nsherlynrandchopraxfxfxxdxfxfxxdxfxfxxd
2,hame sirf chodna aata hai,hame sirf chodna aata hai
2,rt   toh phir aajao maidaan meindekhe kon pahle girta heinnchut ya lundxf0x9fx98x82xf0x9fx98x82xf0x9fx98x82xf0x9fx98x82xf0x9fx98x82,rt toh phir aajao maidaan meindekhe kon pahle girta heinnchut ya lundxfxfxxxfxfxxxfxfxxxfxfxxxfxfxx
2,reply me once raand,reply raand
2,laal salam kaalo raand ko jaa pakistan jaa or dhanda vahi kar apna jaa k yaha tera rate kam hai dubaixe2x80xa6,laal salam kaalo raand ko jaa pakistan jaa dhanda vahi kar apna jaa k yaha tera rate kam hai dubaixexxa
2,sali raand,sali raand
2,apki randi app sab ki wait kar rahi hai ab aa bhi jao uffffff,apki randi app sab ki wait kar rahi hai ab aa bhi jao uffffff
1,so this girl abusing me telling me to commit suicide calling me randi and saying that its written in quran for hxe2x80xa6,girl abusing telling commit suicide calling randi saying written quran hxexxa
0,rt  and if i ever cross ur mind make sure u write down the times so i will know the moments i was eating you alive,rt ever cross ur mind make sure u write times know moments eating alive
0,rt  stopnnlaw 101ndont sign that ticketnand as a represenative of the person in your birth certificate who dont existanxe2x80xa6,rt stopnnlaw ndont sign ticketnand represenative person birth certificate dont existanxexxa
2,randi ka baccha saala,randi ka baccha saala
2,rt  apki randi app sab ki wait kar rahi hai ab aa bhi jao uffffff,rt apki randi app sab ki wait kar rahi hai ab aa bhi jao uffffff
2,isko zyada lun pr uchalne ka shook ha  kisi rasti randi ka bacha ha,isko zyada lun pr uchalne ka shook ha kisi rasti randi ka bacha ha
2,randi ke janme maderchod kutte jhoot bhok rahe haesymbiosis sims ki kissi bhi chokri ne chokre ko propose nahi kixe2x80xa6,randi ke janme maderchod kutte jhoot bhok rahe haesymbiosis sims ki kissi bhi chokri ne chokre ko propose nahi kixexxa
2,rt  ye randi burchodi chinal dost ki sanskari biwi  himast mal hi sali kya lund chusti hi rand jaise hamre lund ki bhukhixe2x80xa6,rt ye randi burchodi chinal dost ki sanskari biwi himast mal hi sali kya lund chusti hi rand jaise hamre lund ki bhukhixexxa
0,if youre interested we would love for you to try life time heres a free pass  ve,youre interested would love try life time heres free pass
2,meri randi bahan ko zalil kro mere samne mere sath,meri randi bahan ko zalil kro mere samne mere sath
2,is bar congresiyo ka evm ka randi rona pahle se hi start hai,bar congresiyo ka evm ka randi rona pahle se hi start hai
2,where are you randi we miss you this week,randi miss week
0,rt  boiling oil poured on his facencastratednhead cut opennflung into a lakenwill 21yearold paresh mestas murder shake ixe2x80xa6,rt boiling oil poured facencastratednhead cut opennflung lakenwill yearold paresh mestas murder shake ixexxa
2,nteri maa ki chootnmodi aa k teri maa ko chodega ram rahum aasaaam ban k aur tu randi ki tarah maxe2x80xa6,nteri maa ki chootnmodi aa k teri maa ko chodega ram rahum aasaaam ban k aur tu randi ki tarah maxexxa
2,wow koi randi mere sath real sex karegi kya,wow koi randi mere sath real sex karegi kya
1,rite ya mulla party isaia ha randi ka bacha kabi na sacha,rite ya mulla party isaia ha randi ka bacha kabi na sacha
2,gd morning mare randi,gd morning mare randi
2,not here to break your heart but ill break your pussy chut faadkr h rhunga randi faaccchxe2x80xa6,break heart ill break pussy chut faadkr h rhunga randi faaccchxexxa
2,hy randi mera loda legi,hy randi mera loda legi
2,aazo baazo se badhweamprandiya bhonk rahe haitere nam pe khel kar ke duniya ko thage thentaake hum badhweamprandiyo kixe2x80xa6,aazo baazo se badhweamprandiya bhonk rahe haitere nam pe khel kar ke duniya ko thage thentaake hum badhweamprandiyo kixexxa
2,abe randi ki aulad  tujh jaise kutte ko bura nahi mante seedha gand pe laath martee hain,abe randi ki aulad tujh jaise kutte ko bura nahi mante seedha gand pe laath martee hain
2,chup randi chod,chup randi chod
2,brother  called ik an asshole she is just an attention seeking randi her and hxe2x80xa6,brother called ik asshole attention seeking randi hxexxa
1,rt  attention k lye allah k bnay huyy insano pahly bandar kutta bolty ho or jab attention mil jatii tw public mai randi roxe2x80xa6,rt attention k lye allah k bnay huyy insano pahly bandar kutta bolty ho jab attention mil jatii tw public mai randi roxexxa
2,mere is sexy hot randi jism par apke lund ka haq hai ufffff apke mast lund ne hi mujhe yeh jism diya haixe2x80xa6,mere sexy hot randi jism par apke lund ka haq hai ufffff apke mast lund ne hi mujhe yeh jism diya haixexxa
2,bhairava ho tum dadal randi ka dadali kro jaygda kamayo ge,bhairava ho tum dadal randi ka dadali kro jaygda kamayo ge
2,tou 8 dfa match hua hai tou utni dfa hi khelega na randi ke bache,tou dfa match hua hai tou utni dfa hi khelega na randi ke bache
0,if you are constantly dating people who are not relationship oriented then its time you reevaluate the people you choose to date,constantly dating people relationship oriented time reevaluate people choose date
2,tu tnsn mt le teri shaadi k baad bhi tere pati k saamne randi banunga tujhe,tu tnsn mt le teri shaadi k baad bhi tere pati k saamne randi banunga tujhe
0,once upon a time nora the insane drug addict set sail for adventure an old drugged out drug addict told nora a stxe2x80xa6,upon time nora insane drug addict set sail adventure old drugged drug addict told nora stxexxa
2,sahin kaha tune randi sale khud hame invite karte hi tum randiyo ki jawanxe2x80xa6,sahin kaha tune randi sale khud hame invite karte hi tum randiyo ki jawanxexxa
2,98kafir ho k gire miya bhai dukkaro ki halat ab bhonkye kutto jaisi hogyi hainek ladki ka chori kar kar ke miya bxe2x80xa6,kafir ho k gire miya bhai dukkaro ki halat ab bhonkye kutto jaisi hogyi hainek ladki ka chori kar kar ke miya bxexxa
1,thoko manojit randizade pen2007 se mera goo khayndukkar ki mere pe nazr kharab thinhindu dukkar mere se jaltaxe2x80xa6,thoko manojit randizade pen se mera goo khayndukkar ki mere pe nazr kharab thinhindu dukkar mere se jaltaxexxa
2,beeemar kausar randinsar se pair tak hazaar beemariyankeede padeli randinphoteli handinpublic toiletnhazar ke bixe2x80xa6,beeemar kausar randinsar se pair tak hazaar beemariyankeede padeli randinphoteli handinpublic toiletnhazar ke bixexxa
2,apni maa ko bhi randi bolta he kya bhadwe sale,apni maa ko bhi randi bolta kya bhadwe sale
0,rt  our favourite australian novels of this year xe2x9dxa4xefxb8x8f      xe2x80xa6,rt favourite australian novels year xexdxaxefxbxf xexxa
2,zeeshan pig ampkausar randi moonh kala karte pakde gay to uski gang bolebehanampbhai moonh kala karte pakde gaynareapxe2x80xa6,zeeshan pig ampkausar randi moonh kala karte pakde gay uski gang bolebehanampbhai moonh kala karte pakde gaynareapxexxa
0,rt  another false story this time in the failing  that i watch 48 hours of television a day  wrong  also i sxe2x80xa6,rt another false story time failing watch hours television day wrong also sxexxa
0,rt  walter b gibson was a skeptic njames randi is a skeptic nthe skepticxc2xae communityxe2x84xa2xc2xa9xcfx80 is a selfobsessed coven of cameraxe2x80xa6,rt walter b gibson skeptic njames randi skeptic nthe skepticxcxae communityxexxaxcxaxcfx selfobsessed coven cameraxexxa
0,hahahbro u call ur channel a news channelits just a propaganda channelkal aise 2 hourxe2x80xa6,hahahbro u call ur channel news channelits propaganda channelkal aise hourxexxa
0,rt   aage aur kya hoga ncongress jeeti to  democracy ki jeetnbjp jeeti to evms were hacked,rt aage aur kya hoga ncongress jeeti democracy ki jeetnbjp jeeti evms hacked
2,rt  fav randi,rt fav randi
2,haaaaa  meri randi kuttiya  baat toh hai tere chusne mai,haaaaa meri randi kuttiya baat toh hai tere chusne mai
2,m gonna stuck my dick deep in ja fucking pussy slut teri cbutado ka haal behal krdiya haixe2x80xa6,gon na stuck dick deep ja fucking pussy slut teri cbutado ka haal behal krdiya haixexxa
2,chodu bol meri randi,chodu bol meri randi
0,i liked a  video  james randis fiery takedown of psychic fraud,liked video james randis fiery takedown psychic fraud
0,3d printed pancakes what a way to start a morning smarttech 3dprinting foodtech stemed,printed pancakes way start morning smarttech dprinting foodtech stemed
2,tere muh me daal du loda baal pakad karrandi ki tarah chulodunga kutiya ko,tere muh daal du loda baal pakad karrandi ki tarah chulodunga kutiya ko
0,151,
2,abe yaar aa gaya randi rona karega ab ye bc,abe yaar aa gaya randi rona karega ab ye bc
1,muslim free ki randi hoti h uncut ki,muslim free ki randi hoti h uncut ki
2,2 inch ka b ni ha tere pass randi aurat xf0x9fx98x92,inch ka b ni ha tere pass randi aurat xfxfxx
2,rt  move on my cock       xe2x80xa6,rt move cock xexxa
0,rt  pic1 what should have been congress narrative  development  development development  gst etc pic2 advisors of xe2x80xa6,rt pic congress narrative development development development gst etc pic advisors xexxa
2,kausar beemari randiamp,kausar beemari randiamp
0,rt  newprofilepic chay ki ketli ahmedabad,rt newprofilepic chay ki ketli ahmedabad
2,rt   mere is sexy hot randi jism par apke lund ka haq hai ufffff apke mast lund ne hi mujhe yeh jism diya hai muaaaahxe2x80xa6,rt mere sexy hot randi jism par apke lund ka haq hai ufffff apke mast lund ne hi mujhe yeh jism diya hai muaaaahxexxa
0,hahahbro u call ur channel a news channelits just a propaganda channelkaxe2x80xa6,hahahbro u call ur channel news channelits propaganda channelkaxexxa
0,rt  a whatsapp msg that needs to be circulated modis 3 biggest achievementsn1 kejriwal stopped talkingn2 manmohan startxe2x80xa6,rt whatsapp msg needs circulated modis biggest achievementsn kejriwal stopped talkingn manmohan startxexxa
2,puri gaand fatnetk chod rha hu tujhe randi faaaccchhh fffaaaccchhhh,puri gaand fatnetk chod rha hu tujhe randi faaaccchhh fffaaaccchhhh
2,randi noble prize hai avn awards nahi jo tera i haq hoga,randi noble prize hai avn awards nahi jo tera haq hoga
2,randi of jehadis prashant bhushan,randi jehadis prashant bhushan
0,walter b gibson was a skeptic njames randi is a skeptic nthe skepticxc2xae communityxe2x84xa2xc2xa9xcfx80 is a selfobsessed covenxe2x80xa6,walter b gibson skeptic njames randi skeptic nthe skepticxcxae communityxexxaxcxaxcfx selfobsessed covenxexxa
0,rt  hyderabad door to door evangelists encounter angry hindus no more free run for conversions   hxe2x80xa6,rt hyderabad door door evangelists encounter angry hindus free run conversions hxexxa
2,and you khudki toh kuch pehchaan nahi lagta hai randi ki aulad hai isiliye muh chupake fakxe2x80xa6,khudki toh kuch pehchaan nahi lagta hai randi ki aulad hai isiliye muh chupake fakxexxa
0,once upon a time nora the creep lunatic left her home an old insane lunatic told nora a story listen well shexe2x80xa6,upon time nora creep lunatic left home old insane lunatic told nora story listen well shexexxa
2,yhi teri aukat hai randi,yhi teri aukat hai randi
2,rt  desi randi with group of guys,rt desi randi group guys
1,rt  the islamisation of europe takes place everywhere we received this from bologna italy,rt islamisation europe takes place everywhere received bologna italy
0,rt  to everyone who gave keaton a voice give ashawntydavis rosalieavila a voice minorityxe2x80x99s get bullied amp,rt everyone gave keaton voice give ashawntydavis rosalieavila voice minorityxexxs get bullied amp
1,why did muslims killed pandits in kashmir idiots,muslims killed pandits kashmir idiots
2,rt     teri maa ki choot faad ke kutto ko khila dege or land kaat ke hot dog bana dege or bech degexe2x80xa6,rt teri maa ki choot faad ke kutto ko khila dege land kaat ke hot dog bana dege bech degexexxa
2,gift lelo fir nobke prize ke saath randi jaan xf0x9fx98x88xf0x9fx98x88,gift lelo fir nobke prize ke saath randi jaan xfxfxxxfxfxx
2,rt  kasi lag rahi hai apki randi,rt kasi lag rahi hai apki randi
2,shameless teri maa sale kinnar patel harami randi ki aulad,shameless teri maa sale kinnar patel harami randi ki aulad
0,yes,yes
0,iam top boy,iam top boy
2,modi ka randi rona,modi ka randi rona
2,sexy lag rhi ha meri randi,sexy lag rhi ha meri randi
2,hina rockx shilpa randi shockx,hina rockx shilpa randi shockx
0,dont expect a perfect love from any of your close ones  just show them what it is,dont expect perfect love close ones show
2,rt  meri randi mom,rt meri randi mom
0,winter sun chic,winter sun chic
0,i care i always care xe2x99xa5,care always care xexxa
0,with you im happy with you,im happy
2,rt  ye mera lund hai jo chod nhi sakta to is kaam me ata hai,rt ye mera lund hai jo chod nhi sakta kaam ata hai
2,nmy randi,nmy randi
2,dhayaan se aapko pta hai mallya ka naam aate hi randi rona shuru ho jaata election time mein,dhayaan se aapko pta hai mallya ka naam aate hi randi rona shuru ho jaata election time mein
2,rt   jisha rape and murder case accused amirul islam found guilty by sessions court ernakulam kerala,rt jisha rape murder case accused amirul islam found guilty sessions court ernakulam kerala
1,ohh ohhhhhhh me behad pyasi sexy rasili hindu sanskari chinal randi muslim lund ki pyasi bessa gulam hun,ohh ohhhhhhh behad pyasi sexy rasili hindu sanskari chinal randi muslim lund ki pyasi bessa gulam hun
2,love to go hard on you randi xf0x9fx98x88n,love go hard randi xfxfxxn
2,wow kya randi hai,wow kya randi hai
0,i canxe2x80x99t sleep because i donxe2x80x99t wanna miss the opening of the polls thatxe2x80x99s never happened before,canxexxt sleep donxexxt wan na miss opening polls thatxexxs never happened
2,rt    not here to break your heart but ill break your pussy chut faadkr h rhunga randi faaccchhhh fxe2x80xa6,rt break heart ill break pussy chut faadkr h rhunga randi faaccchhhh fxexxa
2,o apni behnon ki raat ki kamayi khane wale gashti k bache apxe2x80xa6,apni behnon ki raat ki kamayi khane wale gashti k bache apxexxa
2,kinnar patel harami randi ki aulad sale sowar k bache gandu,kinnar patel harami randi ki aulad sale sowar k bache gandu
0,heartbreaking,heartbreaking
2,desh gaddar congress party randi,desh gaddar congress party randi
2,meri randi kuttiya aaja video call sex karege,meri randi kuttiya aaja video call sex karege
2,rt   mmmmm aisi jabardast chudai hi pasand hai mujhe mmmmm pelo dear jor jor se meri randi chut,rt mmmmm aisi jabardast chudai hi pasand hai mujhe mmmmm pelo dear jor jor se meri randi chut
0,you smiling,smiling
2,kitane grup m h tu randi kuttiya,kitane grup h tu randi kuttiya
2,malkin aapki randi hu maibaith k mutne wali,malkin aapki randi hu maibaith k mutne wali
1,rt  my sister with his hindu boyfriend  how much they love each other she show me this video she made xe2x80xa6,rt sister hindu boyfriend much love show video made xexxa
