hate,text,cleaned_text
2,bhosadchod  hope your company dies a horrible death,bhosadchod hope company dies horrible death
2,bhosadchod zebpay,bhosadchod zebpay
2,lukaku assist bhosadchod,lukaku assist bhosadchod
2,ma chuda bhosadchod,chuda bhosadchod
0,porn mat dekha kar chota hain tu,porn mat dekha kar chota hain tu
2,ohhh so hard fuck me,ohhh hard fuck
0,ha ji oh to dikhta hai,ha ji oh dikhta hai
2,rt    aaaahhhh meri gand  itni zor se meri gand ki chudai kro gy to meri poti kinaray py ajaye ge xf0x9fx98x98xf0x9fx98x98xf0x9fx98x98,rt aaaahhhh meri gand itni zor se meri gand ki chudai kro gy meri poti kinaray py ajaye ge xfxfxxxfxfxxxfxfxx
2,abhi kon kon chudai kar rahe hai,abhi kon kon chudai kar rahe hai
2,randiya na kabhi thakti hai aur na hi kabhi rokti hai hehehe chudai ko sari zidagi chalegi meri jaan,randiya na kabhi thakti hai aur na hi kabhi rokti hai hehehe chudai ko sari zidagi chalegi meri jaan
2,daman aja raat ke liye jam ke karege chudai,daman aja raat ke liye jam ke karege chudai
2,mmmmmm mast jabardast chudai large ho app dear mmmmm,mmmmmm mast jabardast chudai large ho app dear mmmmm
2,ntere followers isliye badh gaye ki tu circus ki chudai me nk 1 haikoi tera mukabala hi nahi kar sakxe2x80xa6,ntere followers isliye badh gaye ki tu circus ki chudai nk haikoi tera mukabala hi nahi kar sakxexxa
2,bir  videosu bexc4x9fendim  javed ny apni chachi ki chudai apny chahu ky kamry me hindi urdu story,bir videosu bexcxfendim javed ny apni chachi ki chudai apny chahu ky kamry hindi urdu story
1,rt  hijab chudai hindu man        xe2x80xa6,rt hijab chudai hindu man xexxa
2,chudai man,chudai man
2,yup lo,yup lo
2,60saal mai kon kya chudai raha tha aur 3saal mai modi kya kar raha hai ye  duniya dekhrahi hsi,saal mai kon kya chudai raha tha aur saal mai modi kya kar raha hai ye duniya dekhrahi hsi
0,kabhi hamare yaha bhi aao,kabhi hamare yaha bhi aao
2,aaja janeman kutty ki tharha chudai karenge hum bhi,aaja janeman kutty ki tharha chudai karenge hum bhi
2,rt  is zabrdast chudai k liye kitne retweet milein ge,rt zabrdast chudai k liye kitne retweet milein ge
2,rt   me behad chudai bessa hun me lund ki ros ki pyasi hun,rt behad chudai bessa hun lund ki ros ki pyasi hun
2,plan to chudai karne tha par koi chut mili hi nhi marne ke liye,plan chudai karne tha par koi chut mili hi nhi marne ke liye
0,xe0xa4xa8xe0xa4xafxe0xa5x87 xe0xa4xb8xe0xa4xbexe0xa4xb2 xe0xa4x95xe0xa5x80 xe0xa4xb0xe0xa4xbexe0xa4xa4 xe0xa4x9cxe0xa4xb5xe0xa4xbexe0xa4xa8 xe0xa4xadxe0xa4xbexe0xa4xadxe0xa5x80 xe0xa4x95xe0xa5x80 xe0xa4x97xe0xa4xbexe0xa4x82xe0xa4xa1 xe0xa4x9axe0xa5x81xe0xa4xa6xe0xa4xbexe0xa4x88,xexaxaxexaxafxexax xexaxbxexaxbexexaxb xexaxxexax xexaxbxexaxbexexaxa xexaxcxexaxbxexaxbexexaxa xexaxadxexaxbexexaxadxexax xexaxxexax xexaxxexaxbexexaxxexaxa xexaxaxexaxxexaxaxexaxbexexax
2,chudai k liye kahin bhi panty utar deti hai mummy,chudai k liye kahin bhi panty utar deti hai mummy
2,koi aur ladka bhi hai aisa jo aapni behan ki chudai iss tehra se karwana chata ho mai uski behan ki chudai karoungaxf0x9fx98x9c,koi aur ladka bhi hai aisa jo aapni behan ki chudai iss tehra se karwana chata ho mai uski behan ki chudai karoungaxfxfxxc
2,tere mummy v na mst chudai karti h,tere mummy v na mst chudai karti h
2,rt  hot chudai,rt hot chudai
0,kya ji abhi  to din hai  na isliye night me,kya ji abhi din hai na isliye night
2,achha sab girls chut ko choos rahi hai,achha sab girls chut ko choos rahi hai
0,yogesh kahan hai  aaj kal,yogesh kahan hai aaj kal
2,ap humari bari behan ho  ap sikhao na plz k knsi kiss kesy hoti hy dear xf0x9fx99x82,ap humari bari behan ho ap sikhao na plz k knsi kiss kesy hoti hy dear xfxfxx
2,rt  apne bf se karwai m ne zabrdast chudai or mera husband pas sota reh gaya full maze kiyenmeri video k liye zyada se zyada retxe2x80xa6,rt apne bf se karwai ne zabrdast chudai mera husband pas sota reh gaya full maze kiyenmeri video k liye zyada se zyada retxexxa
2,regarding greater health chudai,regarding greater health chudai
2,u r right 10000 priya,u r right priya
2,jaaan yeh sochte hai ki ladkiya baat karti hai to woh lesbian hai bola to isne sab ladxe2x80xa6,jaaan yeh sochte hai ki ladkiya baat karti hai woh lesbian hai bola isne sab ladxexxa
2,rt  koi aur ladka bhi hai aisa jo aapni behan ki chudai iss tehra se karwana chata ho mai uski behan ki chudai karoungaxf0x9fx98x9c httxe2x80xa6,rt koi aur ladka bhi hai aisa jo aapni behan ki chudai iss tehra se karwana chata ho mai uski behan ki chudai karoungaxfxfxxc httxexxa
2,woowww fuck me,woowww fuck
1,rt  good night chudai hindu man        xe2x80xa6,rt good night chudai hindu man xexxa
2,jitni dewangi sy chosain gi hum itny hi mazy chudai mily to maza aata ha,jitni dewangi sy chosain gi hum itny hi mazy chudai mily maza aata ha
2,rt   aaj kis kis ne chudai ki hai,rt aaj kis kis ne chudai ki hai
0,xe0xa4xaaxe0xa4xa1xe0xa4xbcxe0xa5x8bxe0xa4xb8xe0xa4xa8 xe0xa4xadxe0xa4xbexe0xa4xadxe0xa5x80 xe0xa4x95xe0xa5x8b xe0xa4xabxe0xa5x8dxe0xa4xb0xe0xa5x80 xe0xa4xb8xe0xa5x8dxe0xa4xaaxe0xa4xb0xe0xa5x8dxe0xa4xae xe0xa4xa1xe0xa5x8bxe0xa4xa8xe0xa5x87xe0xa4x9f xe0xa4x95xe0xa4xbfxe0xa4xafxe0xa4xbe2  antarvasna indian sex kahani,xexaxaaxexaxaxexaxbcxexaxbxexaxbxexaxa xexaxadxexaxbexexaxadxexax xexaxxexaxb xexaxabxexaxdxexaxbxexax xexaxbxexaxdxexaxaaxexaxbxexaxdxexaxae xexaxaxexaxbxexaxaxexaxxexaxf xexaxxexaxbfxexaxafxexaxbe antarvasna indian sex kahani
2,mast boobs hai,mast boobs hai
2,tu soja teri maa or main to raat bhar chudai karenge good nightxf0x9fx98x82xf0x9fx98x82xf0x9fx98x82,tu soja teri maa main raat bhar chudai karenge good nightxfxfxxxfxfxxxfxfxx
2,rt  besharm chudai xf0x9fx98x9c,rt besharm chudai xfxfxxc
0,come   i like hindu man,come like hindu man
2,rt  hindu chudai man,rt hindu chudai man
0,naari woman is best all jagah,naari woman best jagah
1,hindu chudai man,hindu chudai man
2,rt  desi chudai,rt desi chudai
2,rt   mmmmmm mast jabardast chudai large ho app dear mmmmm,rt mmmmmm mast jabardast chudai large ho app dear mmmmm
2,rt  ufffffffchudai ho to aisixf0x9fx98xbbxf0x9fx98xbbxf0x9fx98xbbxf0x9fx98xbb,rt ufffffffchudai ho aisixfxfxxbbxfxfxxbbxfxfxxbbxfxfxxbb
0,ok ji raat ko aao,ok ji raat ko aao
2,rt  kal raat ki mast chudai,rt kal raat ki mast chudai
2,chudai ke bare mai sea plane mai soch sakte ho cd accha banega,chudai ke bare mai sea plane mai soch sakte ho cd accha banega
2,muaaaah jaan,muaaaah jaan
2,kaise chiodege,kaise chiodege
2,chusai ka nhi hai chudai ka to hai na mood haiaa jao,chusai ka nhi hai chudai ka hai na mood haiaa jao
2,rt    chudai man,rt chudai man
2,ok aaajo lund pe,ok aaajo lund pe
2,itne pyar se chodungaa ki chudai se pyar ho jaaega tmhe xf0x9fx98x89uuuufffffff,itne pyar se chodungaa ki chudai se pyar ho jaaega tmhe xfxfxxuuuufffffff
1,hijab chudai hindu man       xe2x80xa6,hijab chudai hindu man xexxa
2,aaaahhhh meri gand  itni zor se meri gand ki chudai kro gy to meri poti kinaray py ajaye ge xf0x9fx98x98xf0x9fx98x98xf0x9fx98x98,aaaahhhh meri gand itni zor se meri gand ki chudai kro gy meri poti kinaray py ajaye ge xfxfxxxfxfxxxfxfxx
2,rt  oh omg kiya chudai pakda hai,rt oh omg kiya chudai pakda hai
2,or tab hum teri did i ki chudai karta ha jab tere jija tujhe pelta ha xf0x9fx98x82,tab hum teri ki chudai karta ha jab tere jija tujhe pelta ha xfxfxx
2,niche bhi mast hai chut,niche bhi mast hai chut
2,chudai karwalo badan garam ho jaiga,chudai karwalo badan garam ho jaiga
1,rt    hindu chudai man,rt hindu chudai man
2,mai aajaun chudai ki thamanna hai,mai aajaun chudai ki thamanna hai
2,kon chus raha hai yaha chut muaaaaah flying kiss hoti hai dear,kon chus raha hai yaha chut muaaaaah flying kiss hoti hai dear
0,rt  a thread of date venues in london continuous,rt thread date venues london continuous
2,your a moany cunt xf0x9fx98x82xf0x9fx98x82 back to the benefits for you xf0x9fx98x82xf0x9fx98x82,moany cunt xfxfxxxfxfxx back benefits xfxfxxxfxfxx
2,still was a laugh last time bro and check dms and ill bring my ps4 so u can chall some cuntsxe2x80xa6,still laugh last time bro check dms ill bring ps u chall cuntsxexxa
2,that lloyd russell sounds like a right cunt,lloyd russell sounds like right cunt
2,rt  hahahahaha cant take this cunt seriously anymore thierry on wii fuck sake man,rt hahahahaha cant take cunt seriously anymore thierry wii fuck sake man
2,trump called his sexualassault accuser a cunt racist imbeciles voted for him anyway and axe2x80xa6,trump called sexualassault accuser cunt racist imbeciles voted anyway axexxa
0,where would you like me to put it xf0x9fx98x81xf0x9fx91x85xf0x9fx91x85,would like put xfxfxxxfxfxxxfxfxx
0,rt  lmaooooo why are people that arent in my life anymore still slagging me off xf0x9fxa4xa6xf0x9fx8fxbcxe2x80x8dxe2x99x80xefxb8x8fxf0x9fxa4xa6xf0x9fx8fxbcxe2x80x8dxe2x99x80xefxb8x8fxf0x9fxa4xa6xf0x9fx8fxbcxe2x80x8dxe2x99x80xefxb8x8f get a fucking grip you bitxe2x80xa6,rt lmaooooo people arent life anymore still slagging xfxfxaxaxfxfxfxbcxexxdxexxxefxbxfxfxfxaxaxfxfxfxbcxexxdxexxxefxbxfxfxfxaxaxfxfxfxbcxexxdxexxxefxbxf get fucking grip bitxexxa
2,there is no better woman than who always keeps her cunt fully shaved,better woman always keeps cunt fully shaved
0,bhool na mat main wapas aa raha hoon,bhool na mat main wapas aa raha hoon
2,rt  aye nae bother dae that over here and thatl get sent right inty the burds groupchat afore you blink and theyre fuckin tearin uxe2x80xa6,rt aye nae bother dae thatl get sent right inty burds groupchat afore blink theyre fuckin tearin uxexxa
0,you could have humoured  its away now xf0x9fx98x81xf0x9fx98x81,could humoured away xfxfxxxfxfxx
2,rt  getting my cunt trashed last nights bamff and hungerff see full vid on hungerff xtube feed   doble punch  vers ff hxe2x80xa6,rt getting cunt trashed last nights bamff hungerff see full vid hungerff xtube feed doble punch vers ff hxexxa
2,rt  what a fucking cunt manhatten,rt fucking cunt manhatten
0,some cunt throw them in the river   thismorning,cunt throw river thismorning
2,i like to use the phrase xe2x80x9cbusy cuntxe2x80x9d for people like this,like use phrase xexxcbusy cuntxexxd people like
2,fuck carl anyway hexe2x80x99s a cunt,fuck carl anyway hexexxs cunt
0,xe5x8fxafxe6x84x9bxe3x81xbfxe2x97x8enxefxbcxbcxe7x94x9fxe3x81x8dxe8xbfx94xe3x81xa3xe3x81x9fxefxbcx8f,xexfxafxexxbxexxbfxexxenxefxbcxbcxexxfxexxdxexbfxxexxaxexxfxefxbcxf
0,the irony that utd and mourinho whining about city xe2x80x9cover celebratingxe2x80x9d when utd spent the past 20 years being the moxe2x80xa6,irony utd mourinho whining city xexxcover celebratingxexxd utd spent past years moxexxa
2,youre cut that navs an ugly cunt too but he can pull,youre cut navs ugly cunt pull
2,rt  swear to fuck am the most unlucky cunt on this planet,rt swear fuck unlucky cunt planet
2,im certainly not lil but i can definitely pound your cunt,im certainly lil definitely pound cunt
2,im furious this cunt is an abuser,im furious cunt abuser
0,sahi hai ha ha ha,sahi hai ha ha ha
2,rt  its hit n miss with call centres youre either gna get that foreign cunt who can barely speak english or that one thats anxe2x80xa6,rt hit n miss call centres youre either gna get foreign cunt barely speak english one thats anxexxa
2,release the album lazy cunt,release album lazy cunt
2,the little cunt played us all,little cunt played us
2,rt  good morning everyone except that cunt raiola,rt good morning everyone except cunt raiola
0,xe6xa5xbdxe3x81x97xe3x81x8fxe3x81xaaxe3x81xa3xe3x81xa6xe3x82x8bxe3x81x98xe3x82x83xe3x82x93xe7xacx91nxefxbcxbcxe9x81x95xe3x81x86xe3x82x88xefxbcx8f,xexaxbdxexxxexxfxexxaaxexxaxexxaxexxbxexxxexxxexxxexacxnxefxbcxbcxexxxexxxexxxefxbcxf
2,anyone who constantly talks about bitcoin is a cunt,anyone constantly talks bitcoin cunt
2,its merry christmas you vapid cunt,merry christmas vapid cunt
2,rt  you changednnno you turned into a cunt man,rt changednnno turned cunt man
2,if he was so fucken good and decent hes still be a senator put thexe2x80xa6,fucken good decent hes still senator put thexexxa
2,fuck you and your transphobic sexist and downright appalling views of how women should live theirxe2x80xa6,fuck transphobic sexist downright appalling views women live theirxexxa
2,ugh why cant my tweets blow up like yours you fucking cunt,ugh cant tweets blow like fucking cunt
2,bitch wasnt crying when she held that kid down though dumb cunt,bitch wasnt crying held kid though dumb cunt
2,australians say the word cunt just as we say fuck so causally give him a break,australians say word cunt say fuck causally give break
0,xe3x81x84xe3x82x84xefxbdxb1xefxbex9exefxbdxb1xefxbex9exefxbdxb1xefxbex9exefxbdxb1xefxbex9exefxbdxb1xefxbex9exefxbdxb1xefxbex9exefxbdxb1xefxbex9exefxbdxb1xefxbex9exefxbdxb1xefxbex9exefxbdxb1xefxbex9exe2x86x90nxefxbcxbcxe3x83x9exe3x83xaaxe3x82xaaxe3x81x8bxe3x82x88xefxbcx8f,xexxxexxxefxbdxbxefxbexexefxbdxbxefxbexexefxbdxbxefxbexexefxbdxbxefxbexexefxbdxbxefxbexexefxbdxbxefxbexexefxbdxbxefxbexexefxbdxbxefxbexexefxbdxbxefxbexexefxbdxbxefxbexexexxnxefxbcxbcxexxexexxaaxexxaaxexxbxexxxefxbcxf
2,we need an intervention to get puppers away from that fat cunt before she kills him,need intervention get puppers away fat cunt kills
0,rt  im taxing that cuntnnxf0x9fx94xb4xc2xa315 skype dommesxf0x9fx94xb4nn lt,rt im taxing cuntnnxfxfxxbxcxa skype dommesxfxfxxbnn lt
2,zaha all day 7 mins 20 sec in the cunt needs putting through a wood chipperxe2x80xa6,zaha day mins sec cunt needs putting wood chipperxexxa
2,rt   fucking try me cunt,rt fucking try cunt
2,shutup u fucking cunt,shutup u fucking cunt
0,rt  when censoring my tweet from saying xe2x80x9ca cuntxe2x80x9d to xe2x80x9ca bit of a knobxe2x80x9d i ended up tweeting out a typo so what did we learn txe2x80xa6,rt censoring tweet saying xexxca cuntxexxd xexxca bit knobxexxd ended tweeting typo learn txexxa
2,rude cunt,rude cunt
2,cunt,cunt
0,i just heard that pyrocynical said the resident evil 4 chainsaw controller is the single worst invention in the hisxe2x80xa6,heard pyrocynical said resident evil chainsaw controller single worst invention hisxexxa
2,lucky cunt,lucky cunt
2,raulix is a very real cunt,raulix real cunt
2,shut ur fucking gob cunt,shut ur fucking gob cunt
2,rt  i was actually calling him a fucking cunt x,rt actually calling fucking cunt x
2,that guy really is a cunt isnt he,guy really cunt isnt
2,rt  went in dry and made his walls wet xf0x9fx8dx91 this doesnt begin to show how fucking hot and creamy his cunt was xf0x9fx8dx86xf0x9fx8dx86xf0x9fx8dx86 goodassxe2x80xa6,rt went dry made walls wet xfxfxdx doesnt begin show fucking hot creamy cunt xfxfxdxxfxfxdxxfxfxdx goodassxexxa
2,fuck your grandma u cunt,fuck grandma u cunt
0,what do you take me for xf0x9fx98x82xf0x9fx98x82xf0x9fx98x82xf0x9fx99x84xf0x9fx99x84,take xfxfxxxfxfxxxfxfxxxfxfxxxfxfxx
2,rt  expose this cunt,rt expose cunt
2,so basically some cunt called some cunt fat and the other was like i didnxe2x80x99t call any cunt fat thatxe2x80x99s baxe2x80xa6,basically cunt called cunt fat like didnxexxt call cunt fat thatxexxs baxexxa
2,diving cunt,diving cunt
2,suck your dad you cunt,suck dad cunt
2,alright every hacked cunt is muted,alright every hacked cunt muted
2,top definition nnfapnnthe onomatopoeic representation of masturbation often used to suggest that something is attractive,top definition nnfapnnthe onomatopoeic representation masturbation often used suggest something attractive
2,to call a cunt a cunt,call cunt cunt
2,lying cunt,lying cunt
2,rt  payback time bitch for being an cunt my followers lets do cumtributes on this pathetic bitch xf0x9fx92xafxf0x9fx92x8bxf0x9fx94xae special surprize ixe2x80xa6,rt payback time bitch cunt followers lets cumtributes pathetic bitch xfxfxxafxfxfxxbxfxfxxae special surprize ixexxa
2,fucking braindead cunt,fucking braindead cunt
2,that argentinian bastard is an cunt,argentinian bastard cunt
2,chew will knee fur bee cunt tent hit,chew knee fur bee cunt tent hit
2,maybe an akb is the massive cunt that reported you,maybe akb massive cunt reported
0,xe3x82x86xe3x81x8dxe3x81xaexefxbcx81nxe9xa3xb2xe3x81xbfxe3x81xabxe8xa1x8cxe3x81x8fxe8xa1x8cxe3x81x8fxe8xa9x90xe6xacxbaxe7x99xbaxe5x8bx95xe4xb8xad,xexxxexxdxexxaexefxbcxnxexaxbxexxbfxexxabxexaxcxexxfxexaxcxexxfxexaxxexacxbaxexxbaxexbxxexbxad
0,in deed,deed
2,haan kal phone kiya naa aapko  another cunt,haan kal phone kiya naa aapko another cunt
2,sticky hot semen fills her cunt panties,sticky hot semen fills cunt panties
2,and thatxe2x80x99s why ya cunt now xf0x9fx98x82xf0x9fx98x82xf0x9fx98x82xf0x9fx98x82 thismorning,thatxexxs ya cunt xfxfxxxfxfxxxfxfxxxfxfxx thismorning
2,tbh i think its just people taking the opportunity to call you a cunt which will never get boring,tbh think people taking opportunity call cunt never get boring
2,so because i say the word cunt a lot im all of a sudden a sexist,say word cunt lot im sudden sexist
0,someone has just tried to tell me xe2x80x9ctechnically he didnxe2x80x99t win us the points against west haxe2x80xa6,someone tried tell xexxctechnically didnxexxt win us points west haxexxa
0,the nirodh and malad ads i still remember the jingle were usually postxe2x80xa6,nirodh malad ads still remember jingle usually postxexxa
0,i think govt add of nirodh but cant find link that are very rarely played on doordarshannndeluxe nirodh,think govt add nirodh cant find link rarely played doordarshannndeluxe nirodh
0,safe sex ad gone to dustbins nirodh advertisements used to be shown in good old doordxe2x80xa6,safe sex ad gone dustbins nirodh advertisements used shown good old doordxexxa
0,actually hes right earlier nobody banned nirodh ads why  decency in format and presentation,actually hes right earlier nobody banned nirodh ads decency format presentation
0,rt  deluxe nirodh waala ad accha tha bacche to samajh hi nahi paate the ki condom ka ad hai yaa chhatri ka xf0x9fx98x84nncondomad conxe2x80xa6,rt deluxe nirodh waala ad accha tha bacche samajh hi nahi paate ki condom ka ad hai yaa chhatri ka xfxfxxnncondomad conxexxa
0,because of that early  nirodh ad i  always assocaite pedal boats with sex,early nirodh ad always assocaite pedal boats sex
0,my earliest memory of condom ads were as a child watching doordarsh as of  a couple pxe2x80xa6,earliest memory condom ads child watching doordarsh couple pxexxa
0,yeah but in india you either have those 80s ka maladnirodh ads jis mein kuch samajhxe2x80xa6,yeah india either ka maladnirodh ads jis mein kuch samajhxexxa
0,on the subject of condom ads best condom ad was without a doubt nirodh one aaj bhi kahin pyaar hua ikraar huaxe2x80xa6,subject condom ads best condom ad without doubt nirodh one aaj bhi kahin pyaar hua ikraar huaxexxa
0,nirodh ka virodh part 1,nirodh ka virodh part
0,rt  on the subject of condom ads best condom ad was without a doubt nirodh one aaj bhi kahin pyaar hua ikraar hua gaanxe2x80xa6,rt subject condom ads best condom ad without doubt nirodh one aaj bhi kahin pyaar hua ikraar hua gaanxexxa
1,pappu nirodh chun liya gya,pappu nirodh chun liya gya
0,rt  no condom ads between 6 am and 10 pm says iampb ministry  we have had these ads since the 80s rigxe2x80xa6,rt condom ads pm says iampb ministry ads since rigxexxa
0,condomads safesex thoughtpolice population control billions 6to10 facepalm nirodh xe2x80xa6,condomads safesex thoughtpolice population control billions facepalm nirodh xexxa
0,i used to see nirodh ads on tv when i was a child was simply told itxe2x80x99s a medicine forxe2x80xa6,used see nirodh ads tv child simply told itxexxs medicine forxexxa
0,oh shit i read it bena nirodh adhyaksh chunay gaexf0x9fx98x82 xf0x9fx98x82 xf0x9fx98x82 xf0x9fx98x82,oh shit read bena nirodh adhyaksh chunay gaexfxfxx xfxfxx xfxfxx xfxfxx
0,nirodh chun liye gye,nirodh chun liye gye
0,rt  stupid three decades ago nirodh ads used to be broadcast on tv and radio openly why the ads were as sterile as any govt axe2x80xa6,rt stupid three decades ago nirodh ads used broadcast tv radio openly ads sterile govt axexxa
0,nirodh shd be allowedit is make in indiahahahah,nirodh shd allowedit make indiahahahah
0,exactly my point we have sat through nirodh advts in 90s today these are just somxe2x80xa6,exactly point sat nirodh advts today somxexxa
0,it was because of family planning objectives and most villagers are asleep by 10 pm wxe2x80xa6,family planning objectives villagers asleep pm wxexxa
0,educational ad with a purpose of hiv awareness amp family planning like nirodh hum do hamare do is no harmxe2x80xa6,educational ad purpose hiv awareness amp family planning like nirodh hum hamare harmxexxa
0,whats so uncomfortable movies and tv shows show more than that or we want that ghxe2x80xa6,whats uncomfortable movies tv shows show want ghxexxa
0,sanskar vs nirodh,sanskar vs nirodh
0,no condom ads in primetime well we spent the entire teenage watching nirodh ads on primetime when there was only 1xe2x80xa6,condom ads primetime well spent entire teenage watching nirodh ads primetime xexxa
0,i dont think the govt will have any problem with condom ads being played anytime nnproblem is the way condom adsxe2x80xa6,dont think govt problem condom ads played anytime nnproblem way condom adsxexxa
0,bina nirodh ke,bina nirodh ke
0,will that include the public service announcements that are nirodh advertisements,include public service announcements nirodh advertisements
0,delux nirodh,delux nirodh
0,rt   and   should insist on a rollback of this order for endangering the lives of women and unborn chixe2x80xa6,rt insist rollback order endangering lives women unborn chixexxa
0,deluxe nirodh sabse zyada bikne waale kandome xf0x9fx98x82xf0x9fx98x82,deluxe nirodh sabse zyada bikne waale kandome xfxfxxxfxfxx
0,because nirodh had to be advertised at all times of day and night they couldnt really stop private companies doinxe2x80xa6,nirodh advertised times day night couldnt really stop private companies doinxexxa
0,rahul gandhi is the future of india bend ur knees and bow ur heads bcos in 2019 each one of u modi boys wxe2x80xa6,rahul gandhi future india bend ur knees bow ur heads bcos one u modi boys wxexxa
0,we as  the invincible films thinks to use a condom brand in our upcomming short film interested companies may ofxe2x80xa6,invincible films thinks use condom brand upcomming short film interested companies may ofxexxa
0,aur hum tere jija lagte hai nirodh jaisi surat k,aur hum tere jija lagte hai nirodh jaisi surat k
0,kash ki rajiv n nirodh lagaya hota aaj desh k palle ye nirvirodh na padtaxf0x9fx98x85xf0x9fx98x85xf0x9fx98x85,kash ki rajiv n nirodh lagaya hota aaj desh k palle ye nirvirodh na padtaxfxfxxxfxfxxxfxfxx
0,stupid three decades ago nirodh ads used to be broadcast on tv and radio openly why the ads were as sterile asxe2x80xa6,stupid three decades ago nirodh ads used broadcast tv radio openly ads sterile asxexxa
0,rt  why is nirodh nirdosh  trending has someone realised their mistake anyway forget that on a different note after watching rxe2x80xa6,rt nirodh nirdosh trending someone realised mistake anyway forget different note watching rxexxa
0,condom is good samajh nahin aa raha kya,condom good samajh nahin aa raha kya
0,i think the issue may not be just condom ads but some ads in general eg some deodorant ads nnsome ads irrespxe2x80xa6,think issue may condom ads ads general eg deodorant ads nnsome ads irrespxexxa
0,pity you are comparing manforce with nirodh,pity comparing manforce nirodh
0,deluxe nirodh waala ad accha tha bacche to samajh hi nahi paate the ki condom ka ad hai yaa chhatri ka xf0x9fx98x84nncondomad condomads,deluxe nirodh waala ad accha tha bacche samajh hi nahi paate ki condom ka ad hai yaa chhatri ka xfxfxxnncondomad condomads
0,rt   delux nirodh garbhnirodhak condom purushon ke liye yaun rog or aids ki roktham ke liye laabhdayak,rt delux nirodh garbhnirodhak condom purushon ke liye yaun rog aids ki roktham ke liye laabhdayak
0,the governments nirodh advt should run round the clock not the sunny leone based soft porn,governments nirodh advt run round clock sunny leone based soft porn
0,bhai nirodh se yaad aya xf0x9fx98x89,bhai nirodh se yaad aya xfxfxx
0,rohit bhainye  nirvirodh nkya kahna ye  nirodh  se bhi xe0xa4xaaxe0xa4xbexe0xa4xb5xe0xa4xb0xe0xa4xabxe0xa5x81xe0xa4xb2 xe0xa4xb9xe0xa5x88,rohit bhainye nirvirodh nkya kahna ye nirodh se bhi xexaxaaxexaxbexexaxbxexaxbxexaxabxexaxxexaxb xexaxbxexax
0,difference between durex and nirodh,difference durex nirodh
0,rt   hope this is correctly reported  i guess it wants to stop explicit ads nirodh was advertised by govt itself,rt hope correctly reported guess wants stop explicit ads nirodh advertised govt
0,shit for a moment i read nirodh there xf0x9fx98x82xf0x9fx98x82,shit moment read nirodh xfxfxxxfxfxx
0,in good old doordarshan days nirodh ads were shown during commercial breaks and posters were put up atxe2x80xa6,good old doordarshan days nirodh ads shown commercial breaks posters put atxexxa
0,remember the famous raj kapoor song pyar hua ikrar hua hai and then the punch line deluxe nirodh  that was ad butxe2x80xa6,remember famous raj kapoor song pyar hua ikrar hua hai punch line deluxe nirodh ad butxexxa
0,rt  i think the issue may not be just condom ads but some ads in general eg some deodorant ads nnsome ads irrespective oxe2x80xa6,rt think issue may condom ads ads general eg deodorant ads nnsome ads irrespective oxexxa
0,rt   bhai nirodh se yaad aya xf0x9fx98x89,rt bhai nirodh se yaad aya xfxfxx
0,no condom ads between 6 am and 10 pm says iampb ministry  we have had these ads since thexe2x80xa6,condom ads pm says iampb ministry ads since thexexxa
0,in 80s amp 90s while watching condom ad on doordarshan kids used to ask papa nirodh kya hota hain and answer wasxe2x80xa6,amp watching condom ad doordarshan kids used ask papa nirodh kya hota hain answer wasxexxa
0,so sorry sirnirvirodh ko maine nirodh padhaaxf0x9fx98x82xf0x9fx98x82xf0x9fx98x82,sorry sirnirvirodh ko maine nirodh padhaaxfxfxxxfxfxxxfxfxx
0,btw which ads are you talking about the one for deluxe nirodh or the one for malad if you found thxe2x80xa6,btw ads talking one deluxe nirodh one malad found thxexxa
0,nirodh,nirodh
